<?xml version="1.0" encoding="UTF-8"?>
<load-list xmlns:xsi="http://www.w3.org/2001/XMLSchema-instance" xsi:schemaLocation="http://www.xtpxlib.nl/ns/common ../../../xsd/load-list.xsd"
  xmlns="http://www.xtpxlib.nl/ns/common" force-xdm="false" fail-on-error="false">

  <load-from-disk href="test-contents/binary/Untitled.json" force-xdm="true"/>
  
  <load-from-disk href="test-contents/test.xml" force-xdm="true"/>

  <load-from-disk href="test-contents/binary/non-xml-posing-as-xml.xml" force-xdm="true"/>
  
  <load-from-disk href="test-contents/xml-posing-as-non-xml.something" force-xdm="true"/>

  <load-from-disk href="test-contents/does-not-exist.xml" force-xdm="true"/>

  <load-from-zip href="file:/C:/Data/Erik/work/xatapult/xtpxlib-common/xpl3mod/load-list/test/test-contents.zip">
    <entry name="test-contents/test.xml"/>
  </load-from-zip>

</load-list>
